{"scenarioId":"1326","source":"AWS Terrarium DEM z7 mosaic","cols":192,"rows":72,"bounds":{"west":26,"south":36,"east":42,"north":42},"min":-4120,"max":3517,"values":[205,273,329,393,436,250,116,297,417,406,438,337,359,504,613,563,532,564,440,266,340,121,131,193,7,-46,-63,-65,-120,-72,-114,-252,-576,-733,-988,-1025,-1259,-1505,-1667,-1891,-1982,-2020,-2031,-2123,-2132,-2141,-2089,-2002,-2041,-2031,-2021,-2008,-2007,-1940,-1921,-1968,-1912,-1864,-1859,-1972,-1932,-1984,-2028,-2063,-2068,-2064,-2052,-2034,-2021,-2018,-2042,-1991,-1869,-1898,-1939,-1723,-1527,-1375,-1330,-1056,-706,-333,-117,-35,-25,53,21,587,609,561,560,184,580,570,327,378,273,429,16,-20,-4,87,-4,-30,-19,21,59,103,121,-29,-60,-85,-113,-96,-136,-206,-377,-503,-755,-1031,-975,-708,-591,-800,-1031,-1067,-958,-663,-401,-461,-941,-1611,-1863,-1988,-1969,-1995,-2004,-1983,-1974,-2001,-1953,-1919,-1926,-1958,-2077,-2023,-2067,-2064,-2053,-2081,-2091,-2061,-2015,-2014,-2086,-2142,-2123,-2039,-2009,-1943,-1997,-2004,-1995,-1982,-1970,-1947,-1882,-1857,-1796,-1790,-1756,-1576,-1518,-1429,-1295,-1275,-1193,-1211,-1120,-948,-771,-688,-735,-648,-416,-254,-268,-190,-63,69,62,73,69,140,155,280,423,191,144,188,257,281,346,294,267,342,468,433,513,378,331,421,425,373,200,14,4,-43,-64,-53,-60,-73,-97,-152,-347,-589,-729,-1035,-1214,-1509,-1569,-1791,-1776,-1908,-2012,-2061,-1997,-2042,-2029,-2017,-1992,-1953,-1959,-1964,-1932,-1950,-1976,-1959,-1888,-1924,-1736,-1773,-1817,-1922,-1961,-2024,-2031,-2006,-1941,-1904,-1749,-1670,-1637,-1535,-1514,-1602,-1694,-1369,-873,-419,-25,-40,-18,0,40,391,515,246,248,889,893,1060,884,801,939,721,1423,995,391,1096,686,608,480,413,146,183,476,406,362,419,146,10,-43,-69,-71,-104,-114,-131,-210,-268,-307,-349,-435,-555,-735,-1055,-1056,-1081,-996,-814,-493,-317,-449,-978,-1469,-1829,-1930,-1947,-1966,-1963,-1884,-1853,-1915,-1855,-1821,-1929,-2033,-2053,-2077,-2025,-2060,-2109,-2048,-2072,-2042,-2036,-2137,-2165,-2092,-1984,-1941,-1954,-1931,-1942,-1983,-1982,-1951,-1930,-1930,-1902,-1866,-1864,-1827,-1738,-1673,-1628,-1464,-1443,-1419,-1298,-1159,-996,-944,-944,-902,-803,-580,-447,-388,-258,-289,1,50,97,111,63,72,154,185,240,58,142,169,176,201,195,225,261,293,355,402,495,484,747,654,260,293,129,-8,-57,-67,-58,-59,-61,-86,-110,-173,-492,-638,-914,-1056,-1373,-1649,-1680,-1723,-1699,-1887,-1929,-1851,-1955,-1954,-1958,-1894,-1931,-1899,-1933,-1926,-1910,-1929,-1903,-1878,-1855,-1606,-1596,-1695,-1920,-1979,-2023,-1964,-1976,-1965,-1933,-1840,-1572,-1216,-1014,-931,-867,-851,-370,-59,-47,141,348,217,564,607,180,483,596,506,1006,824,1149,1280,1367,1172,1156,1496,1013,979,1491,1437,687,1065,709,638,481,768,681,815,909,645,396,12,-43,-72,-77,-107,-105,-100,-74,-56,-52,-63,-306,-782,-1080,-941,-975,-963,-806,-572,-361,-167,-420,-917,-1552,-1868,-1933,-1914,-1845,-1756,-1769,-1816,-1792,-1825,-1887,-1970,-1991,-2000,-2109,-2116,-2082,-2028,-2076,-2126,-2087,-1960,-2038,-1921,-1907,-1874,-1880,-1936,-1936,-1972,-1963,-1948,-1901,-1900,-1907,-1872,-1855,-1843,-1815,-1779,-1768,-1688,-1620,-1534,-1429,-1317,-1230,-1227,-1218,-1065,-911,-717,-539,-437,-296,-131,12,225,288,639,162,80,44,43,92,34,151,144,120,149,144,156,139,180,228,244,261,316,356,456,331,323,216,62,-44,-62,-65,-83,-64,-74,-96,-86,-124,-439,-752,-1229,-1251,-1424,-1528,-1398,-1864,-1716,-1631,-1782,-1915,-1844,-1916,-1926,-1957,-1947,-1869,-1810,-1828,-1793,-1817,-1855,-1771,-1628,-1556,-1600,-1836,-1898,-1891,-1876,-1962,-1880,-1826,-1612,-1437,-1065,-808,-604,-153,-59,170,286,479,370,613,610,1035,559,926,479,763,1102,1021,1040,976,1230,1208,1219,1319,1218,1182,1244,1363,1292,1334,1399,1403,1431,1368,1219,1169,1188,816,1126,467,461,127,-36,-71,-95,-66,-31,-6,-4,3,-4,-111,-381,-446,-653,-821,-862,-796,-679,-508,-95,-144,-467,-1058,-1598,-1901,-1905,-1854,-1707,-1685,-1752,-1792,-1830,-1894,-1949,-1974,-2028,-2099,-2135,-2094,-2083,-2041,-2053,-2121,-1970,-1922,-1826,-1831,-1793,-1930,-1988,-1930,-2055,-2010,-2002,-1939,-1908,-1888,-1885,-1836,-1833,-1799,-1787,-1777,-1694,-1685,-1603,-1565,-1462,-1480,-1349,-1153,-984,-935,-755,-394,-247,-197,-14,85,900,1084,434,393,179,58,41,50,32,43,116,121,132,100,85,146,128,184,204,183,238,306,352,316,216,118,61,-10,-68,-66,-65,-70,-62,-77,-87,-88,-182,-451,-731,-920,-1254,-1158,-1516,-1756,-1434,-1577,-1696,-1821,-1630,-1852,-1599,-1730,-1674,-1663,-1608,-1535,-1581,-1708,-1773,-1619,-1550,-1492,-1535,-1549,-1675,-1786,-1680,-1741,-1728,-1404,-1010,-847,-642,-384,-82,-7,292,164,16,31,474,673,264,912,943,751,959,642,1277,909,1203,1044,1112,1104,1022,1054,1066,1107,1157,1367,915,815,572,423,391,432,1316,1296,1294,1228,1118,1150,740,819,718,414,13,7,6,3,12,9,2,-6,-42,-296,-576,-694,-736,-672,-632,-430,-266,-202,-332,-629,-980,-1528,-1770,-1826,-1690,-1660,-1783,-1865,-1910,-1922,-1955,-2014,-2050,-2052,-2103,-2123,-1984,-1949,-2006,-2049,-1917,-1880,-1910,-1900,-1828,-1922,-1999,-1925,-2050,-2057,-1960,-1968,-2008,-1905,-1859,-1785,-1755,-1763,-1753,-1724,-1687,-1666,-1621,-1573,-1581,-1475,-1340,-1206,-1118,-907,-585,-211,-72,9,134,492,1010,509,334,238,113,146,81,79,27,42,73,121,121,79,136,137,133,126,117,168,207,212,221,134,287,233,161,230,-5,-52,-64,-74,-69,-39,-88,-86,-92,-96,-106,-159,-559,-857,-1351,-1410,-1140,-1481,-1804,-1498,-1475,-1803,-1642,-1621,-1272,-1139,-867,-787,-1043,-1356,-1718,-1511,-1357,-1440,-1448,-1425,-1220,-1566,-1485,-1393,-1414,-944,-414,-124,-27,-24,190,82,61,82,109,115,146,355,796,974,912,879,1001,1065,1285,1093,1479,1233,1368,1325,1208,1226,1254,1228,922,705,620,767,1243,1155,1085,903,304,393,553,542,858,1247,1120,432,1183,530,338,433,168,157,21,65,11,3,-31,-172,-264,-477,-551,-443,-359,-295,-229,-203,-221,-227,-241,-588,-1213,-1685,-1667,-1597,-1786,-1885,-1877,-1925,-1984,-1967,-1982,-2008,-2084,-2061,-2016,-2024,-1935,-1957,-1996,-2005,-1969,-1951,-1959,-1970,-1989,-1998,-2111,-2240,-2125,-2069,-2160,-2033,-1869,-1787,-1738,-1707,-1741,-1853,-1820,-1696,-1667,-1655,-1640,-1535,-1482,-1368,-1202,-795,-422,-181,-21,623,45,89,1098,1191,402,200,89,42,91,133,42,30,108,60,92,67,59,102,82,131,94,136,150,151,137,138,158,160,233,322,381,123,30,-45,-39,-68,-72,-87,-83,-83,-94,-102,-102,-338,-1059,-376,-1174,-1093,-1502,-1427,-1252,-1521,-1365,-565,-547,-510,-343,-234,-429,-1188,-1445,-1226,-1195,-1255,-1128,-1024,-894,-722,-665,-607,-446,-187,-74,29,460,362,373,169,75,96,194,281,365,515,576,589,1059,996,993,947,1123,1267,1053,1034,939,946,752,754,747,701,671,657,693,860,967,1225,1015,541,444,374,254,440,425,641,1084,1270,962,1304,1027,755,392,314,260,140,295,4,-24,-55,-115,-290,-155,-138,-79,-84,-121,-104,-112,-147,-162,-320,-719,-1330,-1536,-1565,-1738,-1791,-1741,-1735,-1812,-1854,-1899,-1910,-1960,-1986,-1941,-1873,-1941,-1944,-1993,-2088,-1964,-1963,-1947,-1931,-1994,-2058,-2182,-2249,-2158,-2152,-2062,-1907,-1848,-1744,-1745,-1762,-1931,-1993,-1846,-1752,-1787,-1798,-1749,-1677,-1419,-1347,-1236,-314,-200,-43,526,470,207,1347,1254,1455,124,130,211,72,48,27,101,23,123,94,33,23,63,33,55,74,62,57,102,99,119,147,134,161,232,227,205,69,68,36,17,-17,-44,-65,-75,-76,-84,-77,-88,-97,-134,-100,-95,-525,-735,-468,-31,-339,-206,-77,-102,-89,-109,-82,-497,-1297,-1229,-900,-1123,-1053,-809,-508,-325,-157,-94,-60,34,250,429,620,638,258,121,180,175,630,691,882,1295,1306,907,965,963,1058,1096,790,1191,1149,1230,1274,1472,1240,1070,877,915,1008,1037,1109,1005,1307,1252,1190,1054,852,624,516,377,778,517,182,405,1078,766,697,933,656,725,202,505,750,662,286,75,-23,-49,-67,-44,-9,-7,-14,-20,-22,-88,-94,-142,-455,-820,-1181,-1325,-1323,-1483,-1500,-1525,-1365,-1440,-1598,-1693,-1767,-1826,-1831,-1845,-1783,-1887,-1892,-1923,-1967,-1995,-2024,-1936,-1936,-1989,-2035,-2124,-2058,-2046,-2082,-1723,-1506,-1552,-1736,-1800,-1828,-2059,-2173,-1846,-1682,-1818,-1858,-1709,-1400,-788,-340,-202,-39,44,178,914,317,779,1692,2043,2306,181,242,58,101,167,16,51,71,12,21,88,113,107,33,43,51,83,58,63,125,133,115,187,180,155,207,210,217,284,100,57,109,47,56,-19,-43,-69,-65,-57,-63,-62,-44,-62,-60,-65,-70,-74,-73,-36,-90,-67,-64,-83,-125,-643,-1114,-1072,-505,-423,-394,-347,-286,-139,-88,-46,208,247,387,447,567,589,331,299,92,377,848,322,1029,1317,1329,733,851,969,1074,969,980,1196,1017,919,991,1109,1112,1048,1088,1034,1215,1370,1066,1345,1605,1455,1396,1414,1248,773,703,707,412,869,745,429,729,671,245,224,909,1038,445,682,626,937,421,174,44,-10,-26,-6,7,11,11,7,4,-16,-42,-94,-283,-708,-1059,-1037,-1020,-1179,-1076,-847,-889,-1142,-1339,-1372,-1433,-1394,-1434,-1584,-1726,-1794,-1685,-1671,-1660,-1624,-1694,-1682,-1745,-1801,-1919,-1854,-1609,-1565,-1715,-1489,-1452,-1405,-1533,-1654,-1596,-1633,-1823,-1727,-1685,-1627,-1534,-960,-490,-129,-75,229,263,966,905,870,666,550,989,2022,2023,321,587,249,132,40,60,51,19,87,97,194,222,109,42,53,97,122,107,103,114,168,148,167,124,107,165,136,136,47,76,31,76,147,129,78,176,142,19,76,49,44,-18,-25,-26,-44,-29,-60,-51,-46,-45,-35,9,-36,-39,-60,-138,-273,-119,-88,-75,-87,-76,-71,-42,-27,29,186,264,340,642,738,102,704,664,324,139,188,410,1286,315,469,365,424,403,685,712,702,873,1148,984,851,1009,1245,1104,1300,1467,1388,1458,1216,1750,1613,1928,1565,1439,1570,1027,616,1151,886,549,513,235,337,432,388,888,987,894,834,696,664,718,228,701,619,52,13,16,19,20,15,9,-9,-28,-49,-99,-105,-522,-730,-437,-220,-187,-7,-274,-641,-916,-955,-815,-775,-921,-1087,-1173,-1441,-1190,-1307,-1210,-819,-557,-632,-953,-943,-1163,-1300,-944,-1018,-1325,-1369,-1257,-1134,-1292,-1465,-1353,-1435,-1650,-1656,-1491,-830,-413,-22,-15,63,503,578,1160,1461,2340,880,2539,953,535,859,1576,536,208,147,45,42,79,26,57,178,246,275,184,96,57,70,142,183,199,198,152,74,103,154,62,186,36,91,73,209,170,3,160,65,125,56,74,75,284,152,36,193,102,46,163,143,132,115,48,47,51,119,63,5,6,7,3,-15,-32,-51,-55,-42,-41,-40,-7,129,100,320,384,1000,637,275,616,769,888,651,683,575,1597,376,626,319,472,641,638,473,1607,1346,1573,1676,1615,1304,1271,1560,1472,1848,1946,1829,1684,1426,1271,866,366,495,497,577,617,1265,1592,1663,998,594,751,528,412,447,388,686,833,1053,736,917,514,769,723,777,341,127,142,26,57,68,96,208,61,81,10,-11,-129,-190,-112,-34,11,-82,-92,-173,-331,-1